{
  "$schema": "https://json-schema.org/draft/2020-12/schema",
  "$id": "https://intentproof.dev/schema/policy.v1.schema.json",
  "title": "VerificationPolicy",
  "type": "object",
  "$defs": {
    "Iso8601Duration": {
      "type": "string",
      "pattern": "^P(?=\\d|T)(?:\\d+Y)?(?:\\d+M)?(?:\\d+W)?(?:\\d+D)?(?:T(?=\\d)(?:\\d+H)?(?:\\d+M)?(?:\\d+(?:\\.\\d+)?S)?)?$"
    },
    "AttributePredicate": {
      "type": "object",
      "properties": {
        "status": { "type": "string", "enum": ["ok", "error"] },
        "attribute": { "type": "string", "minLength": 1 },
        "equals": { "type": ["string", "number", "boolean", "null"] },
        "in": {
          "type": "array",
          "items": { "type": ["string", "number", "boolean", "null"] },
          "minItems": 1
        }
      },
      "anyOf": [
        { "required": ["status"] },
        { "required": ["attribute"] }
      ]
    },
    "RequiredRule": {
      "type": "object",
      "properties": {
        "id": { "type": "string" },
        "category": { "type": "string", "const": "required" },
        "severity": { "type": "string", "enum": ["critical", "high", "medium", "low", "info"] },
        "spec": {
          "type": "object",
          "properties": {
            "action": { "type": "string" },
            "min": { "type": "integer", "minimum": 0 },
            "max": { "type": "integer", "minimum": 0 },
            "where": { "$ref": "#/$defs/AttributePredicate" }
          },
          "required": ["action"]
        }
      },
      "required": ["id", "category", "spec"]
    },
    "ForbiddenRule": {
      "type": "object",
      "properties": {
        "id": { "type": "string" },
        "category": { "type": "string", "const": "forbidden" },
        "severity": { "type": "string", "enum": ["critical", "high", "medium", "low", "info"] },
        "spec": {
          "type": "object",
          "properties": {
            "action": { "type": "string" },
            "after": { "type": "string" },
            "where_predecessor": { "$ref": "#/$defs/AttributePredicate" },
            "where": { "$ref": "#/$defs/AttributePredicate" },
            "without_predecessor": { "type": "string" }
          },
          "required": ["action"],
          "allOf": [
            {
              "not": {
                "required": ["where_predecessor", "without_predecessor"]
              }
            },
            {
              "anyOf": [
                {
                  "not": {
                    "anyOf": [
                      { "required": ["where_predecessor"] },
                      { "required": ["without_predecessor"] }
                    ]
                  }
                },
                { "required": ["after"] }
              ]
            }
          ]
        }
      },
      "required": ["id", "category", "spec"]
    },
    "OrderingRule": {
      "type": "object",
      "properties": {
        "id": { "type": "string" },
        "category": { "type": "string", "const": "ordering" },
        "severity": { "type": "string", "enum": ["critical", "high", "medium", "low", "info"] },
        "spec": {
          "type": "object",
          "properties": {
            "before": { "type": "string" },
            "after": { "type": "string" },
            "scope": { "type": "string", "enum": ["first-occurrence", "all-occurrences"] },
            "match_by_attribute": { "type": "string" }
          },
          "required": ["before", "after"]
        }
      },
      "required": ["id", "category", "spec"]
    },
    "CardinalityRule": {
      "type": "object",
      "properties": {
        "id": { "type": "string" },
        "category": { "type": "string", "const": "cardinality" },
        "severity": { "type": "string", "enum": ["critical", "high", "medium", "low", "info"] },
        "spec": {
          "type": "object",
          "properties": {
            "action": { "type": "string" },
            "exactly": { "type": "integer", "minimum": 0 },
            "min": { "type": "integer", "minimum": 0 },
            "max": { "type": "integer", "minimum": 0 },
            "count_basis": { "type": "string", "enum": ["logical", "raw"] },
            "where": { "$ref": "#/$defs/AttributePredicate" }
          },
          "required": ["action"],
          "oneOf": [
            {
              "required": ["exactly"],
              "not": {
                "anyOf": [
                  { "required": ["min"] },
                  { "required": ["max"] }
                ]
              }
            },
            {
              "not": { "required": ["exactly"] },
              "anyOf": [
                { "required": ["min"] },
                { "required": ["max"] }
              ]
            }
          ]
        }
      },
      "required": ["id", "category", "spec"]
    },
    "ValueBoundRule": {
      "type": "object",
      "properties": {
        "id": { "type": "string" },
        "category": { "type": "string", "const": "value_bound" },
        "severity": { "type": "string", "enum": ["critical", "high", "medium", "low", "info"] },
        "spec": {
          "type": "object",
          "properties": {
            "claim": { "type": "string" },
            "operator": { "type": "string", "enum": ["lt", "lte", "gt", "gte", "eq", "ne"] },
            "value": { "type": "number" },
            "source_id": { "type": "string" }
          },
          "required": ["claim", "operator", "value"]
        }
      },
      "required": ["id", "category", "spec"]
    },
    "ClaimMatchRule": {
      "type": "object",
      "properties": {
        "id": { "type": "string" },
        "category": { "type": "string", "const": "claim_match" },
        "severity": { "type": "string", "enum": ["critical", "high", "medium", "low", "info"] },
        "spec": {
          "type": "object",
          "properties": {
            "claim": { "type": "string" },
            "expected_value": {},
            "source_id": { "type": "string" },
            "require_signed": { "type": "boolean" }
          },
          "required": ["claim", "expected_value"]
        }
      },
      "required": ["id", "category", "spec"]
    },
    "TemporalRule": {
      "type": "object",
      "properties": {
        "id": { "type": "string" },
        "category": { "type": "string", "const": "temporal" },
        "severity": { "type": "string", "enum": ["critical", "high", "medium", "low", "info"] },
        "spec": {
          "type": "object",
          "properties": {
            "from": {
              "type": "object",
              "properties": {
                "action": { "type": "string" },
                "anchor": { "type": "string", "enum": ["started_at", "completed_at"] }
              },
              "required": ["action"]
            },
            "to": {
              "type": "object",
              "properties": {
                "action": { "type": "string" },
                "anchor": { "type": "string", "enum": ["started_at", "completed_at"] }
              },
              "required": ["action"]
            },
            "min": { "$ref": "#/$defs/Iso8601Duration" },
            "max": { "$ref": "#/$defs/Iso8601Duration" },
            "clock_skew_tolerance": { "$ref": "#/$defs/Iso8601Duration" }
          },
          "required": ["from", "to"],
          "anyOf": [
            { "required": ["min"] },
            { "required": ["max"] }
          ]
        }
      },
      "required": ["id", "category", "spec"]
    },
    "ConsensusRule": {
      "type": "object",
      "properties": {
        "id": { "type": "string" },
        "category": { "type": "string", "const": "consensus" },
        "severity": { "type": "string", "enum": ["critical", "high", "medium", "low", "info"] },
        "spec": {
          "type": "object",
          "properties": {
            "claim": { "type": "string" },
            "expected_value": {},
            "require_signed_sources": { "type": "boolean" },
            "sources": {
              "type": "array",
              "items": {
                "type": "object",
                "properties": {
                  "kind": { "type": "string", "enum": ["intentproof_action", "external"] },
                  "action": { "type": "string" },
                  "where": { "$ref": "#/$defs/AttributePredicate" },
                  "source_id": { "type": "string" },
                  "channel": { "type": "string" }
                },
                "required": ["kind"]
              },
              "minItems": 1
            },
            "threshold": {
              "type": "object",
              "properties": {
                "unanimous": { "type": "boolean" },
                "majority": { "type": "boolean" },
                "agree_at_least": { "type": "integer", "minimum": 1 }
              }
            }
          },
          "required": ["claim", "sources", "threshold"]
        }
      },
      "required": ["id", "category", "spec"]
    }
  },
  "properties": {
    "schema": { "type": "string", "const": "intentproof.policy.v1" },
    "policy_id": { "type": "string" },
    "policy_version": { "type": "integer", "minimum": 1 },
    "tenant_id": { "type": "string" },
    "provenance_class": {
      "type": "string",
      "const": "platform_attested",
      "default": "platform_attested"
    },
    "name": { "type": "string" },
    "description": { "type": "string" },
    "rfc_version": { "type": "string" },
    "spec_version": { "type": "string" },
    "scope": {
      "type": "object",
      "properties": {
        "any_event_action_in": {
          "type": "array",
          "items": { "type": "string" }
        },
        "ignore_flows_with_no_match": { "type": "boolean" }
      }
    },
    "instrumentation_requirement": {
      "type": "string",
      "enum": ["full", "operational", "minimal"]
    },
    "rules": {
      "type": "array",
      "items": {
        "anyOf": [
          { "$ref": "#/$defs/RequiredRule" },
          { "$ref": "#/$defs/ForbiddenRule" },
          { "$ref": "#/$defs/OrderingRule" },
          { "$ref": "#/$defs/CardinalityRule" },
          { "$ref": "#/$defs/TemporalRule" },
          { "$ref": "#/$defs/ConsensusRule" },
          { "$ref": "#/$defs/ValueBoundRule" },
          { "$ref": "#/$defs/ClaimMatchRule" }
        ]
      }
    },
    "claims": {
      "type": "array",
      "items": { "$ref": "claim.v1.schema.json" }
    },
    "policy_fingerprint": { "type": "string" },
    "signed_at": { "type": "string", "format": "date-time" },
    "signature": {
      "type": "object",
      "properties": {
        "alg": { "type": "string" },
        "key_id": { "type": "string" },
        "value": { "type": "string" }
      }
    }
  },
  "required": [
    "schema", "policy_id", "policy_version", "tenant_id", "provenance_class",
    "spec_version", "scope", "rules", "policy_fingerprint"
  ],
  "additionalProperties": false
}